{
  "version": 1,
  "name": "Reuse check",
  "canvas": {
    "width": 1280,
    "height": 720,
    "fps": 30,
    "background": "#101014"
  },
  "duration": 60,
  "assets": {
    "counter": {
      "src": "assets/counter/counter.png"
    },
    "cup": {
      "src": "assets/cup/cup.png"
    },
    "kitchen_bg": {
      "src": "assets/kitchen_bg/kitchen_bg.png"
    }
  },
  "camera": {
    "x": 0,
    "y": 0,
    "scale": 1,
    "rotation": 0
  },
  "layers": [
    {
      "id": "bg",
      "asset": "kitchen_bg",
      "x": 640,
      "y": 360,
      "width": 1280,
      "height": 720,
      "anchorX": 0.5,
      "anchorY": 0.5,
      "z": 0
    },
    {
      "id": "counter",
      "asset": "counter",
      "x": 640,
      "y": 470,
      "width": 1400,
      "height": 475,
      "anchorX": 0.5,
      "anchorY": 0,
      "z": 20
    },
    {
      "id": "cupA",
      "asset": "cup",
      "x": 500,
      "y": 516,
      "width": 96,
      "height": 90,
      "anchorX": 0.5,
      "anchorY": 1,
      "z": 25
    },
    {
      "id": "cupB",
      "asset": "cup",
      "x": 400,
      "y": 8,
      "width": 82,
      "height": 77,
      "anchorX": 0.5,
      "anchorY": 1,
      "z": 25,
      "parent": "cupA"
    }
  ],
  "animations": [
    {
      "target": "cupA",
      "property": "visible",
      "keyframes": [
        {
          "frame": 0,
          "value": true,
          "interpolation": "step"
        },
        {
          "frame": 30,
          "value": false,
          "interpolation": "step"
        },
        {
          "frame": 45,
          "value": true,
          "interpolation": "step"
        }
      ]
    }
  ],
  "audio": []
}